<?xml version="1.0" encoding="UTF-8" standalone="no"?>

<!DOCTYPE personas SYSTEM "personas.dtd">

<personas>
    <persona>
        <nombre dni="_123456M" edad="50" sexo="H">
            Jose Luis
        </nombre>
        <email>jlg@gmail.com</email>
        <parentesco padre_de="_2345J"/>
    </persona>
    <persona>
        <nombre dni="_2345J" edad="17" sexo="M">
            Mar√≠a
        </nombre>
        <email>mgg@gmail.com</email>
    </persona>
    <persona>
        <nombre dni="_54785F" sexo="H">
            Pedro
        </nombre>
        <email>pgg@gmail.com</email>
        <parentesco hermano_de="_2345J"/>
    </persona>
</personas>